Идентификатор,Наименование,Описание,Объект воздействия,Компоненты,Способы реализации,Потенциал нарушителя,Меры защиты
УБИ.4.6.25,Угроза несанкционированной подмены компонентов активного сетевого оборудования за счет атаки на системы с распределенным реестром,"Угроза заключается во внедрении ложного или подмене существующего компонента информационной системы и (или) обрабатываемой с его использованием информации.
Например, подмена DNS-сервера",О.6 Активное сетевое оборудование,К.2.2.8 Сетевой интерфейс,СП.25.1 Атаки на механизмы идентификации участников системы распределенного реестра,"В.1 Нарушитель, обладающий базовыми возможностями","ЗИС.3.1 Распределение средств защиты информации по разным уровням (эшелонам) защищаемой системы;
ЗИС.12.1 Изоляция процессов (выполнение программ) в выделенной области памяти;
ЗИС.19.1 Защита информации от раскрытия, модификации и навязывания (ввода ложной информации) при ее передаче (подготовке к передаче) по каналам связи, имеющим выход за пределы контролируемой зоны ;
ЗИС.20.1 Обеспечение доверенных маршрутов передачи данных между администратором (пользователем) и средствами защиты информации (функциями безопасности средств защиты информации), определяемыми оператором;
ЗИС.27.1 Обеспечение подлинности сетевых соединений (сеансов взаимодействия), в том числе для защиты от подмены сетевых устройств и сервисов (защита от атак типа «человек посередине»);
ЗИС.35.1 Фильтрация сетевого трафика, в том числе между внешними сетями и внутренними, в том числе при организации сетевого обмена с сетями связи общего пользования;
ЗИС.35.2 Обеспечение доверенных канала, маршрута внутри инфраструктуры между администратором, пользователем и средствами защиты информации (функциями безопасности);
ЗИС.35.3 Контроль передачи служебных информационных сообщений, передаваемых в сетях, хостовой операционной системы, по составу, объёму и иным характеристикам ;
ЗИС.35.4 Отключение неиспользуемых сетевых протоколов компонентами инфраструктуры, хостовой операционной системы, вычислительной сети ;
ЗИС.35.5 Обеспечение подлинности сетевых соединений (сеансов взаимодействия) внутри инфраструктуры, в том числе для защиты от подмены сетевых устройств и сервисов;
ЗИС.35.6 Обеспечение изоляции потоков данных, передаваемых и обрабатываемых компонентами инфраструктуры и сетевых потоков вычислительной сети;
ЗИС.35.7 Семантический и статистический анализ сетевого трафика вычислительной сети;
ИАФ.1.4 Многофакторная (двухфакторная) аутентификация пользователей;
ИНЦ.1.1 Сбор и первичная обработка информации, поступающей от источников событий информационной безопасности ;
ИНЦ.1.2 Автоматический анализ событий информационной безопасности и выявление компьютерных инцидентов (компьютерных атак) ;
ИНЦ.1.3 Ретроспективный анализ данных и выявление не обнаруженных ранее компьютерных инцидентов ;
ИНЦ.2.1 Определение механизмов оперативного информирования пользователями службы безопасности о фактах выявления компьютерного инцидента. Назначение ответственного лица за информирование НКЦКИ.;
ИНЦ.3.1 Назначение должностного лица (группы расследования), имеющего навыки проведения подобных расследований;
ИНЦ.3.2 Определение текущего и потенциального воздействия инцидента на организацию, идентификация затронутой инфраструктуры и определение соответствующего направления работы;
ИНЦ.4.1 Переоценка угроз безопасности информации, повлекших возникновение инцидента ;
ИНЦ.4.2 Определение в соответствии с выявленными угрозами безопасности инофрмации мер защиты информации для минимизации выявленных угроз, в случае повторения инцидента;
ИНЦ.4.3  Актуализация необходимых политик, регламентов, инструкций;
ИНЦ.4.4 Проведение обучения персонала организации, включая сотрудников подразделения по защите информации, для повышения осведомленности в части обеспечения безопасности;
ИНЦ.5.1 Совершенствование политик информационной безопасности;
ИНЦ.5.2 Проведение дополнительного обучения сотрудников, ознакомление с правилами обращения с конфиденциальной информацией;
ИНЦ.5.3 Разработка соответствующих регламентов;
ИНЦ.5.4 Доведение до сотрудников информации о недопустимости несанкционированной передачи конфиденциальной информации за пределы организации и ответственности за нарушение установленных в организации правил;
ИНЦ.5.5 Доведение до сотрудников информации о недопустимости несанкционированной передачи конфиденциальной информации за пределы организации и ответственности за нарушение установленных в организации правил;
ИНЦ.5.6 Ограничение доступа сотрудника к конфиденциальной информации;
ИНЦ.5.7 Вынесение предупреждений и другие меры административного характера;
ИНЦ.5.8 Установка средств защиты информации;
ИНЦ.5.9 Модернизация или замена компонентов информационных систем;
ИНЦ.5.10 Пересмотр и настройка минимальных прав доступа;
ИНЦ.5.11 Проведение аудита защищенности, тестирования на проникновение;
ИНЦ.6.1 Регламентация правил и процедур защиты информации о событиях безопасности;
ИНЦ.6.2 Обеспечение защиты средств выявления (регистрации) инцидентов и настроек механизмов выявления (регистрации) инцидентов;
ИНЦ.6.3 Обеспечение доступа к записям о компьютерных инцидентах и функциям управления механизмами выявления (регистрации) инцидентов только уполномоченным должностным лицам ;
ОДТ.7.1 Выделение групп однотипных узлов, объединенных каналами передачи информации и рассматриваемых как единый программно\002технический ресурс, информационной системы в целом и (или) отдельных ее сегментов (серверов приложений, файловых серверов, серверов баз данных, средств защиты информации и иных сегментов) для обеспечения доступности информации, сервисов и механизмов защиты информации ;
УКФ.3.2 Установка (инсталляция) в информационной системе программного обеспечения и (или) его компонентов должна осуществляться только от имени администратора;
УПД.0.1 Разработка правил и процедур (политик) управления доступом;
УПД.1.1 Определение типа учетной записи (внутреннего пользователя, внешнего пользователя; системная, приложения; гостевая (анонимная), временная и (или) иные типы записей);
УПД.1.2 Объединение учетных записей в группы (при необходимости);
УПД.1.3 Верификация пользователя (проверка личности пользователя, его должностных (функциональных) обязанностей) при заведении учетной записи пользователя;
УПД.1.4 Заведение, активация, блокирование и уничтожение учетных записей пользователей;
УПД.1.5 Пересмотр и, при необходимости, корректировка учетных записей пользователей с периодичностью, определяемой субъектом;
УПД.1.6 Регламентация и контроль использования гостевых (анонимных) и временных учетных записей пользователей, а также привилегированных учетных записей администраторов;
УПД.1.7 Оповещение администратора, осуществляющего управление учетными записями пользователей, об изменении сведений о пользователях, их ролях, обязанностях, полномочиях, ограничениях;
УПД.1.8 Уничтожение временных учетных записей пользователей, предоставленных для однократного (ограниченного по времени) выполнения задач;
УПД.1.9 Предоставление пользователям прав доступа к объектам доступа, основываясь на задачах, решаемых пользователями;
УПД.2.1 Реализация дискреционного метода управления доступом, предусматривающего управление доступом субъектов доступа к объектам доступа на основе идентификационной информации субъекта и для каждого объекта доступа – списка, содержащего набор субъектов доступа (групп субъектов) и ассоциированных с ними типов доступа;
УПД.2.2 Реализация ролевого метода управления доступом, предусматривающего управление доступом субъектов доступа к объектам доступа на основе ролей субъектов доступа (совокупность действий и обязанностей, связанных с определенным видом деятельности);
УПД.2.3 Реализация мандатного метода управления доступом, предусматривающего управление доступом субъектов доступа к объектам доступа на основе сопоставления классификационных меток каждого субъекта доступа и каждого объекта доступа, отражающих классификационные уровни субъектов доступа и объектов доступа, являющиеся комбинациями иерархических и неиерархических категорий;
УПД.4.1 Разделение полномочий (ролей) пользователей, администраторов и лиц, обеспечивающих функционирование информационной системы, в соответствии с их должностными обязанностями (функциями). Определение в организационно-распорядительных документах по защите информации (документирование) полномочий (ролей) пользователей, администраторов и лиц, обеспечивающих функционирование информационной системы.;
УПД.5.1 Назначение прав и привилегий пользователям и запускаемым от их имени процессам, администраторам и лицам, обеспечивающим функционирование, минимально необходимых для выполнения ими своих должностных обязанностей (функций), и санкционирование доступа к объектам доступа в соответствии с минимально необходимыми правами и привилегиями;
УПД.6.1 Регламентация и контроль количества неуспешных попыток входа ;
УПД.6.2 Блокирование устройства, с которого предпринимаются попытки доступа, и (или) учетной записи пользователя при превышении пользователем ограничения количества неуспешных попыток входа;
УПД.7.1 Оповещение пользователей в виде сообщения («окна») при его входе (до процесса аутентификации) о том, что реализованы меры защиты информации, а также о том, что при работепользователем должны быть соблюдены установленные правила и ограничения на работу с информацией;
УПД.8.1 Оповещение пользователя после успешного входа о дате и времени предыдущего входа от имени этого пользователя;
УПД.9.1 Ограничение числа параллельных сеансов доступа для каждой учетной записи пользователя;
УПД.10.1 Блокирование сеанса доступа пользователя после установленного Субъектом времени его бездействия (неактивности) или по запросу пользователя;
УПД.11.1 Регламентация и контроль действий пользователей, разрешенных до прохождения ими процедур идентификации и аутентификации, и запрет действий пользователей, не включенных в перечень разрешенных действий, до прохождения ими процедур идентификации и аутентификации;
УПД.12.1 Поддержка (обновление, назначение, изменение) и сохранение атрибутов безопасности (меток безопасности), связанных с информацией в процессе ее хранения и обработки;
УПД.13.1 Установление (в том числе документальное) видов доступа, разрешенных для удаленного доступа к объектам доступа;
УПД.13.2 Ограничение на использование удаленного доступа в соответствии с задачами (функциями), для решения которых такой доступ необходим, и предоставление удаленного доступа для каждого разрешенного вида удаленного доступа;
УПД.13.3 Предоставление удаленного доступа только тем пользователям, которым он необходим для выполнения установленных должностных обязанностей (функций);
УПД.13.4 Мониторинг и контроль удаленного доступа на предмет выявления несанкционированного удаленного доступа к объектам доступа;
УПД.13.5 Контроль удаленного доступа пользователей (процессов запускаемых от имени пользователей) к объектам доступа до начала информационного взаимодействия (передачи защищаемой информации);
УПД.14.1 Предоставление доступа только авторизованным (уполномоченным) пользователям;
УПД.14.2 Определение типов прикладного программного обеспечения, к которым разрешен доступ авторизованным (уполномоченным) пользователям из внешних информационных систем;
УПД.14.3 Определение системных учетных записей, используемых в рамках данного взаимодействия;
УПД.14.4 Определение порядка предоставления доступа авторизованными (уполномоченным) пользователями из внешних информационных систем;
УПД.14.5 Определение порядка обработки, хранения и передачи информации с использованием внешних информационных систем"
УБИ.5.2.1,"Угроза удаления информации, обрабатываемой сервером за счет эксплуатации уязвимостей","Угроза заключается в несанкционированном удалении обрабатываемой в информационной системе информации (конфиденциальной, конфигурационной, аутентификационной и др.).
Например, удаление информации, обрабатываемой в базе данных, в обход существующих механизмов разграничения доступа",О.2 Сервер,"К.1.2.1 Операционная система;
К.1.2.3 Программная оболочка;
К.1.2.4 Драйвер;
К.1.2.6 Загрузчик операционной системы;
К.1.3.1 Системные и сетевые службы",СП.1.1 Эксплуатация известных уязвимостей,"В.1 Нарушитель, обладающий базовыми возможностями","АУД.2.1 Выявление (поиск) уязвимостей, связанных с ошибками кода в программном (микропрограммном) обеспечении (общесистемном, прикладном, специальном), а также программном обеспечении средств защиты информации, правильностью установки и настройки средств защиты информации, технических средств и программного обеспечения, а также корректностью работы средств защиты информации при их взаимодействии с техническими средствами и программным обеспечением ;
АУД.2.2 Разработка по результатам выявления (поиска) уязвимостей отчетов с описанием выявленных уязвимостей и планом мероприятий по их устранению; анализ отчетов с результатами поиска уязвимостей и оценки достаточности реализованных мер защиты информации ;
АУД.2.3 Устранение выявленных уязвимостей, в том числе путем установки обновлений программного обеспечения средств защиты информации, общесистемного программного обеспечения, прикладного программного обеспечения или микропрограммного обеспечения технических средств ;
АУД.2.4 Информирование должностных лиц оператора (пользователей, администраторов, подразделения по защите информации) о результатах поиска уязвимостей и оценки достаточности реализованных мер защиты информации ;
ОПС.2.5 Определение и применение параметров настройки компонентов программного обеспечения, включая программные компоненты средств защиты информации, обеспечивающих реализацию мер защиты информации, а также устранение возможных уязвимостей информационной системы, приводящих к возникновению угроз безопасности информации"
