Идентификатор,Наименование,Описание,Объект воздействия,Компоненты,Способы реализации,Потенциал нарушителя,Меры защиты
УБИ.1.2.1,"Угроза утечки информации, обрабатываемой сервером, за счет эксплуатации уязвимостей","Угроза заключается в возможности противоправного получения либо передачи информации (конфиденциальной, конфигурационной, аутентификационной и др.).
Например, утечка персональных данных вследствие нарушения хранения или нарушения конфигурации",О.2 Сервер,"К.1.2.1 Операционная система;
К.1.2.3 Программная оболочка;
К.1.2.4 Драйвер;
К.1.2.6 Загрузчик операционной системы;
К.1.3.1 Системные и сетевые службы",СП.1.1 Эксплуатация известных уязвимостей,"В.1 Нарушитель, обладающий базовыми возможностями","АУД.2.1 Выявление (поиск) уязвимостей, связанных с ошибками кода в программном (микропрограммном) обеспечении (общесистемном, прикладном, специальном), а также программном обеспечении средств защиты информации, правильностью установки и настройки средств защиты информации, технических средств и программного обеспечения, а также корректностью работы средств защиты информации при их взаимодействии с техническими средствами и программным обеспечением ;
АУД.2.2 Разработка по результатам выявления (поиска) уязвимостей отчетов с описанием выявленных уязвимостей и планом мероприятий по их устранению; анализ отчетов с результатами поиска уязвимостей и оценки достаточности реализованных мер защиты информации ;
АУД.2.3 Устранение выявленных уязвимостей, в том числе путем установки обновлений программного обеспечения средств защиты информации, общесистемного программного обеспечения, прикладного программного обеспечения или микропрограммного обеспечения технических средств ;
АУД.2.4 Информирование должностных лиц оператора (пользователей, администраторов, подразделения по защите информации) о результатах поиска уязвимостей и оценки достаточности реализованных мер защиты информации ;
ОПС.2.5 Определение и применение параметров настройки компонентов программного обеспечения, включая программные компоненты средств защиты информации, обеспечивающих реализацию мер защиты информации, а также устранение возможных уязвимостей информационной системы, приводящих к возникновению угроз безопасности информации"
УБИ.1.2.2,"Угроза утечки информации, обрабатываемой сервером, за счет использования недостатков конфигурации","Угроза заключается в возможности противоправного получения либо передачи информации (конфиденциальной, конфигурационной, аутентификационной и др.).
Например, утечка персональных данных вследствие нарушения хранения или нарушения конфигурации",О.2 Сервер,"К.1.2.1 Операционная система;
К.1.2.3 Программная оболочка;
К.1.2.4 Драйвер;
К.1.2.6 Загрузчик операционной системы;
К.1.3.1 Системные и сетевые службы","СП.2.2 Использование недостатков, связанных с управлением учетными данными;
СП.2.8 Использование недостатков конфигурации, связанных с настройками по умолчанию (включая пароли по умолчанию);
СП.2.9 Использование недостатков конфигурации, связанных с отсутствием проверки сертификата сети (для беспроводных сетей);
СП.2.10 Использование недостатков конфигурации сетевого оборудования, связанных с отсутствием или некорректной фильтрацией трафика;
СП.2.11 Использование недостатков, связанных с некорректной настройкой прав доступа","В.1 Нарушитель, обладающий базовыми возможностями","АУД.1.3 Контроль выполнения условий и сроков действия сертификатов соответствия на средства защиты информации и принятие мер, направленных на устранение выявленных недостатков;
ЗИС.32.1 Ограничение на использование в информационной системе беспроводных соединений (в частности 802.11хWi-Fi, 802.15.1 Bluetooth, 802.22WRAN, IrDA и иных беспроводных соединений) в соответствии с задачами (функциями) информационной системы, для решения которых такие соединения необходимы;
ЗИС.32.2 Предоставление доступа к параметрам(изменению параметров) настройки беспроводных соединений только администраторам информационной системы; обеспечение возможности реализации беспроводных соединений только через контролируемые интерфейсы (в том числе, путем применения средств защиты информации);
ЗИС.32.3 Регистрация и анализ событий, связанных с использованием беспроводных соединений, в том числе для выявления попыток несанкционированного подключения к информационной системе через беспроводные соединения;
ЗИС.35.1 Фильтрация сетевого трафика, в том числе между внешними сетями и внутренними, в том числе при организации сетевого обмена с сетями связи общего пользования;
ИАФ.4.2 Выдача средств аутентификации пользователям; генерация и выдача начальной аутентификационной информации (начальных значений средств аутентификации);
УПД.1.1 Определение типа учетной записи (внутреннего пользователя, внешнего пользователя; системная, приложения; гостевая (анонимная), временная и (или) иные типы записей);
УПД.1.2 Объединение учетных записей в группы (при необходимости);
УПД.1.3 Верификация пользователя (проверка личности пользователя, его должностных (функциональных) обязанностей) при заведении учетной записи пользователя;
УПД.1.4 Заведение, активация, блокирование и уничтожение учетных записей пользователей;
УПД.1.5 Пересмотр и, при необходимости, корректировка учетных записей пользователей с периодичностью, определяемой субъектом;
УПД.1.6 Регламентация и контроль использования гостевых (анонимных) и временных учетных записей пользователей, а также привилегированных учетных записей администраторов;
УПД.1.7 Оповещение администратора, осуществляющего управление учетными записями пользователей, об изменении сведений о пользователях, их ролях, обязанностях, полномочиях, ограничениях;
УПД.1.8 Уничтожение временных учетных записей пользователей, предоставленных для однократного (ограниченного по времени) выполнения задач;
УПД.1.9 Предоставление пользователям прав доступа к объектам доступа, основываясь на задачах, решаемых пользователями;
УПД.2.1 Реализация дискреционного метода управления доступом, предусматривающего управление доступом субъектов доступа к объектам доступа на основе идентификационной информации субъекта и для каждого объекта доступа – списка, содержащего набор субъектов доступа (групп субъектов) и ассоциированных с ними типов доступа;
УПД.2.2 Реализация ролевого метода управления доступом, предусматривающего управление доступом субъектов доступа к объектам доступа на основе ролей субъектов доступа (совокупность действий и обязанностей, связанных с определенным видом деятельности);
УПД.2.3 Реализация мандатного метода управления доступом, предусматривающего управление доступом субъектов доступа к объектам доступа на основе сопоставления классификационных меток каждого субъекта доступа и каждого объекта доступа, отражающих классификационные уровни субъектов доступа и объектов доступа, являющиеся комбинациями иерархических и неиерархических категорий;
УПД.3.2 Контроль доступа пользователей к процессу загрузки операционной системы;
УПД.4.1 Разделение полномочий (ролей) пользователей, администраторов и лиц, обеспечивающих функционирование информационной системы, в соответствии с их должностными обязанностями (функциями). Определение в организационно-распорядительных документах по защите информации (документирование) полномочий (ролей) пользователей, администраторов и лиц, обеспечивающих функционирование информационной системы.;
УПД.5.1 Назначение прав и привилегий пользователям и запускаемым от их имени процессам, администраторам и лицам, обеспечивающим функционирование, минимально необходимых для выполнения ими своих должностных обязанностей (функций), и санкционирование доступа к объектам доступа в соответствии с минимально необходимыми правами и привилегиями;
УПД.6.2 Блокирование устройства, с которого предпринимаются попытки доступа, и (или) учетной записи пользователя при превышении пользователем ограничения количества неуспешных попыток входа;
УПД.13.1 Установление (в том числе документальное) видов доступа, разрешенных для удаленного доступа к объектам доступа;
УПД.13.2 Ограничение на использование удаленного доступа в соответствии с задачами (функциями), для решения которых такой доступ необходим, и предоставление удаленного доступа для каждого разрешенного вида удаленного доступа;
УПД.13.3 Предоставление удаленного доступа только тем пользователям, которым он необходим для выполнения установленных должностных обязанностей (функций);
УПД.13.5 Контроль удаленного доступа пользователей (процессов запускаемых от имени пользователей) к объектам доступа до начала информационного взаимодействия (передачи защищаемой информации);
УПД.14.1 Предоставление доступа только авторизованным (уполномоченным) пользователям;
УПД.14.2 Определение типов прикладного программного обеспечения, к которым разрешен доступ авторизованным (уполномоченным) пользователям из внешних информационных систем"
УБИ.1.2.3,"Угроза утечки информации, обрабатываемой сервером, за счет использования недостатков архитектуры","Угроза заключается в возможности противоправного получения либо передачи информации (конфиденциальной, конфигурационной, аутентификационной и др.).
Например, утечка персональных данных вследствие нарушения хранения или нарушения конфигурации",О.2 Сервер,К.1.3.1 Системные и сетевые службы,СП.3.1 Эксплуатация недостатков незащищенных протоколов передачи данных,"В.1 Нарушитель, обладающий базовыми возможностями","ЗИС.19.1 Защита информации от раскрытия, модификации и навязывания (ввода ложной информации) при ее передаче (подготовке к передаче) по каналам связи, имеющим выход за пределы контролируемой зоны ;
ЗИС.35.4 Отключение неиспользуемых сетевых протоколов компонентами инфраструктуры, хостовой операционной системы, вычислительной сети "
